entity_namespace,geoid,state,entity_name,entity_kind,universe_vintage,entity_disposition,research_status,last_checked_on,notes
school_district,0607170,CA,Camino Union Elementary School District,elementary_school_district,2025,researchable,not_researched,,
school_district,0607200,CA,Campbell Union Elementary School District,elementary_school_district,2025,researchable,not_researched,,
school_district,0607230,CA,Campbell Union High School District,secondary_school_district,2025,researchable,not_researched,,
school_district,0607260,CA,Camptonville Elementary School District,elementary_school_district,2025,researchable,not_researched,,
school_district,0607350,CA,Canyon Elementary School District,elementary_school_district,2025,researchable,not_researched,,
school_district,0607410,CA,Capay Joint Union Elementary School District,elementary_school_district,2025,researchable,not_researched,,
school_district,0607440,CA,Capistrano Unified School District,unified_school_district,2025,researchable,not_researched,,
school_district,0607470,CA,Cardiff Elementary School District,elementary_school_district,2025,researchable,not_researched,,
school_district,0607500,CA,Carlsbad Unified School District,unified_school_district,2025,researchable,not_researched,,
school_district,0607530,CA,Carmel Unified School District,unified_school_district,2025,researchable,not_researched,,
school_district,0607560,CA,Carpinteria Unified School District,unified_school_district,2025,researchable,not_researched,,
school_district,0607680,CA,Cascade Union Elementary School District,elementary_school_district,2025,researchable,not_researched,,
school_district,0607740,CA,Castaic Union School District,elementary_school_district,2025,researchable,not_researched,,
school_district,0607770,CA,Castle Rock Union Elementary School District,elementary_school_district,2025,researchable,not_researched,,
school_district,0607800,CA,Castro Valley Unified School District,unified_school_district,2025,researchable,not_researched,,
school_district,0607840,CA,Cayucos Elementary School District,elementary_school_district,2025,researchable,not_researched,,
school_district,0607900,CA,Center Joint Unified School District,unified_school_district,2025,researchable,not_researched,,
school_district,0607920,CA,Centinela Valley Union High School District,secondary_school_district,2025,researchable,not_researched,,
school_district,0607950,CA,Central Elementary School District,elementary_school_district,2025,researchable,not_researched,,
school_district,0607970,CA,Central Unified School District,unified_school_district,2025,researchable,not_researched,,
school_district,0607980,CA,Central Union Elementary School District,elementary_school_district,2025,researchable,not_researched,,
school_district,0608010,CA,Central Union High School District,secondary_school_district,2025,researchable,not_researched,,
school_district,0608070,CA,Centralia Elementary School District,elementary_school_district,2025,researchable,not_researched,,
school_district,0608130,CA,Ceres Unified School District,unified_school_district,2025,researchable,not_researched,,
school_district,0608160,CA,Chaffey Joint Union High School District,secondary_school_district,2025,researchable,not_researched,,
school_district,0608190,CA,Charter Oak Unified School District,unified_school_district,2025,researchable,not_researched,,
school_district,0608250,CA,Chatom Union Elementary School District,elementary_school_district,2025,researchable,not_researched,,
school_district,0608340,CA,Chicago Park Elementary School District,elementary_school_district,2025,researchable,not_researched,,
school_district,0608370,CA,Chico Unified School District,unified_school_district,2025,researchable,not_researched,,
school_district,0608460,CA,Chino Valley Unified School District,unified_school_district,2025,researchable,not_researched,,
school_district,0608520,CA,Chowchilla Elementary School District,elementary_school_district,2025,researchable,not_researched,,
school_district,0608550,CA,Chowchilla Union High School District,secondary_school_district,2025,researchable,not_researched,,
school_district,0608580,CA,Chualar Union Elementary School District,elementary_school_district,2025,researchable,not_researched,,
school_district,0608610,CA,Chula Vista Elementary School District,elementary_school_district,2025,researchable,not_researched,,
school_district,0608640,CA,Cienega Union Elementary School District,elementary_school_district,2025,researchable,not_researched,,
school_district,0608700,CA,Cinnabar Elementary School District,elementary_school_district,2025,researchable,not_researched,,
school_district,0608760,CA,Claremont Unified School District,unified_school_district,2025,researchable,not_researched,,
school_district,0608850,CA,Clay Joint Elementary School District,elementary_school_district,2025,researchable,not_researched,,
school_district,0608880,CA,Clear Creek Elementary School District,elementary_school_district,2025,researchable,not_researched,,
school_district,0608970,CA,Cloverdale Unified School District,unified_school_district,2025,researchable,not_researched,,
school_district,0609030,CA,Clovis Unified School District,unified_school_district,2025,researchable,not_researched,,
school_district,0609070,CA,Coachella Valley Unified School District,unified_school_district,2025,researchable,not_researched,,
school_district,0609120,CA,Coalinga-Huron Unified School District,unified_school_district,2025,researchable,not_researched,,
school_district,0609240,CA,Coffee Creek Elementary School District,elementary_school_district,2025,researchable,not_researched,,
school_district,0609270,CA,Cold Spring Elementary School District,elementary_school_district,2025,researchable,not_researched,,
school_district,0609300,CA,Colfax Elementary School District,elementary_school_district,2025,researchable,not_researched,,
school_district,0609330,CA,College Elementary School District,elementary_school_district,2025,researchable,not_researched,,
school_district,0609390,CA,Colton Joint Unified School District,unified_school_district,2025,researchable,not_researched,,
school_district,0609450,CA,Columbia Elementary School District,elementary_school_district,2025,researchable,not_researched,,
school_district,0609480,CA,Columbia Union Elementary School District,elementary_school_district,2025,researchable,not_researched,,
school_district,0609510,CA,Columbine Elementary School District,elementary_school_district,2025,researchable,not_researched,,
school_district,0609570,CA,Colusa Unified School District,unified_school_district,2025,researchable,not_researched,,
school_district,0609620,CA,Compton Unified School District,unified_school_district,2025,researchable,not_researched,,
school_district,0609640,CA,Conejo Valley Unified School District,unified_school_district,2025,researchable,not_researched,,
school_district,0609665,CA,Leggett Valley Unified School District,unified_school_district,2025,researchable,not_researched,,
school_district,0609690,CA,Corcoran Joint Unified School District,unified_school_district,2025,researchable,not_researched,,
school_district,0609780,CA,Corning Union Elementary School District,elementary_school_district,2025,researchable,not_researched,,
school_district,0609810,CA,Corning Union High School District,secondary_school_district,2025,researchable,not_researched,,
school_district,0609850,CA,Corona-Norco Unified School District,unified_school_district,2025,researchable,not_researched,,
school_district,0609870,CA,Coronado Unified School District,unified_school_district,2025,researchable,not_researched,,
school_district,0609940,CA,Cotati-Rohnert Park Unified School District,unified_school_district,2025,researchable,not_researched,,
school_district,0609990,CA,Cottonwood Union Elementary School District,elementary_school_district,2025,researchable,not_researched,,
