entity_namespace,geoid,state,entity_name,entity_kind,universe_vintage,entity_disposition,research_status,last_checked_on,notes
school_district,0600001,CA,Acton-Agua Dulce Unified School District,unified_school_district,2025,researchable,not_researched,,
school_district,0600006,CA,Ross Valley Elementary School District,elementary_school_district,2025,researchable,not_researched,,
school_district,0600009,CA,Cuyama Joint Unified School District,unified_school_district,2025,researchable,not_researched,,
school_district,0600011,CA,Fort Sage Unified School District,unified_school_district,2025,researchable,not_researched,,
school_district,0600012,CA,Twin Ridges Elementary School District,elementary_school_district,2025,researchable,not_researched,,
school_district,0600013,CA,Rocklin Unified School District,unified_school_district,2025,researchable,not_researched,,
school_district,0600014,CA,Hesperia Unified School District,unified_school_district,2025,researchable,not_researched,,
school_district,0600015,CA,Lucerne Valley Unified School District,unified_school_district,2025,researchable,not_researched,,
school_district,0600016,CA,Upland Unified School District,unified_school_district,2025,researchable,not_researched,,
school_district,0600017,CA,Apple Valley Unified School District,unified_school_district,2025,researchable,not_researched,,
school_district,0600018,CA,Mountain Valley Unified School District,unified_school_district,2025,researchable,not_researched,,
school_district,0600019,CA,Dublin Unified School District,unified_school_district,2025,researchable,not_researched,,
school_district,0600020,CA,Pleasanton Unified School District,unified_school_district,2025,researchable,not_researched,,
school_district,0600021,CA,Sunol Glen Unified School District,unified_school_district,2025,researchable,not_researched,,
school_district,0600022,CA,Mendota Unified School District,unified_school_district,2025,researchable,not_researched,,
school_district,0600025,CA,Manhattan Beach Unified School District,unified_school_district,2025,researchable,not_researched,,
school_district,0600026,CA,El Tejon Unified School District,unified_school_district,2025,researchable,not_researched,,
school_district,0600027,CA,Lake Elsinore Unified School District,unified_school_district,2025,researchable,not_researched,,
school_district,0600028,CA,Temecula Valley Unified School District,unified_school_district,2025,researchable,not_researched,,
school_district,0600029,CA,Murrieta Valley Unified School District,unified_school_district,2025,researchable,not_researched,,
school_district,0600031,CA,Big Sur Unified School District,unified_school_district,2025,researchable,not_researched,,
school_district,0600032,CA,Redondo Beach Unified School District,unified_school_district,2025,researchable,not_researched,,
school_district,0600033,CA,Dos Palos-Oro Loma Joint Unified School District,unified_school_district,2025,researchable,not_researched,,
school_district,0600034,CA,Windsor Unified School District,unified_school_district,2025,researchable,not_researched,,
school_district,0600035,CA,Farmersville Unified School District,unified_school_district,2025,researchable,not_researched,,
school_district,0600036,CA,Natomas Unified School District,unified_school_district,2025,researchable,not_researched,,
school_district,0600037,CA,Ferndale Unified School District,unified_school_district,2025,researchable,not_researched,,
school_district,0600038,CA,Mattole Unified School District,unified_school_district,2025,researchable,not_researched,,
school_district,0600039,CA,Delhi Unified School District,unified_school_district,2025,researchable,not_researched,,
school_district,0600040,CA,Riverdale Joint Unified School District,unified_school_district,2025,researchable,not_researched,,
school_district,0600042,CA,Warner Unified School District,unified_school_district,2025,researchable,not_researched,,
school_district,0600043,CA,Scotts Valley Unified School District,unified_school_district,2025,researchable,not_researched,,
school_district,0600044,CA,Healdsburg Unified School District,unified_school_district,2025,researchable,not_researched,,
school_district,0600045,CA,Orland Joint Unified School District,unified_school_district,2025,researchable,not_researched,,
school_district,0600046,CA,Gonzales Unified School District,unified_school_district,2025,researchable,not_researched,,
school_district,0600047,CA,Tracy Unified School District,unified_school_district,2025,researchable,not_researched,,
school_district,0600048,CA,Paso Robles Joint Unified School District,unified_school_district,2025,researchable,not_researched,,
school_district,0600049,CA,Coast Unified School District,unified_school_district,2025,researchable,not_researched,,
school_district,0600051,CA,Gridley Unified School District,unified_school_district,2025,researchable,not_researched,,
school_district,0600052,CA,Eureka City Unified School District,unified_school_district,2025,researchable,not_researched,,
school_district,0600060,CA,Hughson Unified School District,unified_school_district,2025,researchable,not_researched,,
school_district,0600061,CA,Riverbank Unified School District,unified_school_district,2025,researchable,not_researched,,
school_district,0600062,CA,Oakdale Joint Unified School District,unified_school_district,2025,researchable,not_researched,,
school_district,0600063,CA,Waterford Unified School District,unified_school_district,2025,researchable,not_researched,,
school_district,0600064,CA,Porterville Unified School District,unified_school_district,2025,researchable,not_researched,,
school_district,0600065,CA,Dinuba Unified School District,unified_school_district,2025,researchable,not_researched,,
school_district,0600067,CA,Caruthers Unified School District,unified_school_district,2025,researchable,not_researched,,
school_district,0600068,CA,Golden Valley Unified School District,unified_school_district,2025,researchable,not_researched,,
school_district,0600069,CA,Valley Center-Pauma Unified School District,unified_school_district,2025,researchable,not_researched,,
school_district,0600116,CA,Chawanakee Unified School District,unified_school_district,2025,researchable,not_researched,,
school_district,0600153,CA,Alhambra Unified School District,unified_school_district,2025,researchable,not_researched,,
school_district,0600158,CA,Turlock Unified School District,unified_school_district,2025,researchable,not_researched,,
school_district,0600159,CA,Scott Valley Unified School District,unified_school_district,2025,researchable,not_researched,,
school_district,0600160,CA,Yosemite Unified School District,unified_school_district,2025,researchable,not_researched,,
school_district,0601331,CA,Trinity Alps Unified School District,unified_school_district,2025,researchable,not_researched,,
school_district,0601332,CA,Twin Rivers Unified School District,unified_school_district,2025,researchable,not_researched,,
school_district,0601339,CA,Hamilton Unified School District,unified_school_district,2025,researchable,not_researched,,
school_district,0601409,CA,Bishop Unified School District,unified_school_district,2025,researchable,not_researched,,
school_district,0601410,CA,Lammersville Joint Unified School District,unified_school_district,2025,researchable,not_researched,,
school_district,0601414,CA,Santa Barbara Unified School District,unified_school_district,2025,researchable,not_researched,,
school_district,0601415,CA,Washington Unified School District,unified_school_district,2025,researchable,not_researched,,
school_district,0601418,CA,Woodlake Unified School District,unified_school_district,2025,researchable,not_researched,,
school_district,0601420,CA,Fortuna Elementary School District,elementary_school_district,2025,researchable,not_researched,,
school_district,0601421,CA,Santa Paula Unified School District,unified_school_district,2025,researchable,not_researched,,
school_district,0601423,CA,Exeter Unified School District,unified_school_district,2025,researchable,not_researched,,
school_district,0601426,CA,Bonsall Unified School District,unified_school_district,2025,researchable,not_researched,,
school_district,0601427,CA,Penn Valley Union Elementary School District,elementary_school_district,2025,researchable,not_researched,,
school_district,0601428,CA,Wiseburn Unified School District,unified_school_district,2025,researchable,not_researched,,
school_district,0601442,CA,Upper Lake Unified School District,unified_school_district,2025,researchable,not_researched,,
school_district,0601620,CA,ABC Unified School District,unified_school_district,2025,researchable,not_researched,,
school_district,0601650,CA,Acalanes Union High School District,secondary_school_district,2025,researchable,not_researched,,
school_district,0601680,CA,Ackerman Elementary School District,elementary_school_district,2025,researchable,not_researched,,
school_district,0601710,CA,Adelanto Elementary School District,elementary_school_district,2025,researchable,not_researched,,
school_district,0601770,CA,Alameda City Unified School District,unified_school_district,2025,researchable,not_researched,,
school_district,0601860,CA,Albany City Unified School District,unified_school_district,2025,researchable,not_researched,,
school_district,0601890,CA,Alexander Valley Union School District,elementary_school_district,2025,researchable,not_researched,,
school_district,0601950,CA,Alisal Union Elementary School District,elementary_school_district,2025,researchable,not_researched,,
school_district,0601980,CA,Allensworth Elementary School District,elementary_school_district,2025,researchable,not_researched,,
school_district,0602010,CA,Alpaugh Unified School District,unified_school_district,2025,researchable,not_researched,,
school_district,0602070,CA,Alpine County Unified School District,unified_school_district,2025,researchable,not_researched,,
school_district,0602100,CA,Alpine Union Elementary School District,elementary_school_district,2025,researchable,not_researched,,
school_district,0602160,CA,Alta Loma Elementary School District,elementary_school_district,2025,researchable,not_researched,,
school_district,0602220,CA,Alta Vista Elementary School District,elementary_school_district,2025,researchable,not_researched,,
school_district,0602250,CA,Alta-Dutch Flat Union Elementary School District,elementary_school_district,2025,researchable,not_researched,,
school_district,0602310,CA,Alum Rock Union Elementary School District,elementary_school_district,2025,researchable,not_researched,,
school_district,0602360,CA,Alview-Dairyland Union Elementary School District,elementary_school_district,2025,researchable,not_researched,,
school_district,0602370,CA,Alvina Elementary School District,elementary_school_district,2025,researchable,not_researched,,
school_district,0602430,CA,Alvord Unified School District,unified_school_district,2025,researchable,not_researched,,
school_district,0602450,CA,Amador County Unified School District,unified_school_district,2025,researchable,not_researched,,
school_district,0602571,CA,Banta Unified School District,unified_school_district,2025,researchable,not_researched,,
school_district,0602610,CA,Anaheim Elementary School District,elementary_school_district,2025,researchable,not_researched,,
school_district,0602630,CA,Anaheim Union High School District,secondary_school_district,2025,researchable,not_researched,,
school_district,0602670,CA,West Sonoma County Union High School District,secondary_school_district,2025,researchable,not_researched,,
school_district,0602700,CA,Anderson Union High School District,secondary_school_district,2025,researchable,not_researched,,
school_district,0602730,CA,Anderson Valley Unified School District,unified_school_district,2025,researchable,not_researched,,
school_district,0602760,CA,Antelope Elementary School District,elementary_school_district,2025,researchable,not_researched,,
school_district,0602820,CA,Antelope Valley Union Joint High School District,secondary_school_district,2025,researchable,not_researched,,
school_district,0602850,CA,Antioch Unified School District,unified_school_district,2025,researchable,not_researched,,
school_district,0602970,CA,Arcadia Unified School District,unified_school_district,2025,researchable,not_researched,,
school_district,0603000,CA,Arcata Elementary School District,elementary_school_district,2025,researchable,not_researched,,
school_district,0603030,CA,Northern Humboldt Union High School District,secondary_school_district,2025,researchable,not_researched,,
school_district,0603060,CA,Arcohe Union Elementary School District,elementary_school_district,2025,researchable,not_researched,,
school_district,0603090,CA,Arena Union Elementary School District,elementary_school_district,2025,researchable,not_researched,,
school_district,0603180,CA,Armona Union Elementary School District,elementary_school_district,2025,researchable,not_researched,,
school_district,0603270,CA,Arvin Union School District,elementary_school_district,2025,researchable,not_researched,,
school_district,0603300,CA,Atascadero Unified School District,unified_school_district,2025,researchable,not_researched,,
school_district,0603420,CA,Atwater Elementary School District,elementary_school_district,2025,researchable,not_researched,,
school_district,0603480,CA,Auburn Union Elementary School District,elementary_school_district,2025,researchable,not_researched,,
school_district,0603600,CA,Azusa Unified School District,unified_school_district,2025,researchable,not_researched,,
school_district,0603610,CA,Baker Valley Unified School District,unified_school_district,2025,researchable,not_researched,,
school_district,0603630,CA,Bakersfield City School District,elementary_school_district,2025,researchable,not_researched,,
school_district,0603690,CA,Baldwin Park Unified School District,unified_school_district,2025,researchable,not_researched,,
school_district,0603720,CA,Ballard Elementary School District,elementary_school_district,2025,researchable,not_researched,,
school_district,0603750,CA,Ballico-Cressey Elementary School District,elementary_school_district,2025,researchable,not_researched,,
school_district,0603780,CA,Bangor Union Elementary School District,elementary_school_district,2025,researchable,not_researched,,
school_district,0603840,CA,Banning Unified School District,unified_school_district,2025,researchable,not_researched,,
school_district,0604020,CA,Barstow Unified School District,unified_school_district,2025,researchable,not_researched,,
school_district,0604080,CA,Bass Lake Joint Union Elementary School District,elementary_school_district,2025,researchable,not_researched,,
school_district,0604110,CA,Bassett Unified School District,unified_school_district,2025,researchable,not_researched,,
school_district,0604200,CA,Bayshore Elementary School District,elementary_school_district,2025,researchable,not_researched,,
school_district,0604230,CA,Bear Valley Unified School District,unified_school_district,2025,researchable,not_researched,,
school_district,0604260,CA,Beardsley Elementary School District,elementary_school_district,2025,researchable,not_researched,,
school_district,0604290,CA,Beaumont Unified School District,unified_school_district,2025,researchable,not_researched,,
school_district,0604350,CA,Bella Vista Elementary School District,elementary_school_district,2025,researchable,not_researched,,
school_district,0604380,CA,Bellevue Union School District,elementary_school_district,2025,researchable,not_researched,,
school_district,0604440,CA,Bellflower Unified School District,unified_school_district,2025,researchable,not_researched,,
school_district,0604500,CA,Belleview Elementary School District,elementary_school_district,2025,researchable,not_researched,,
school_district,0604530,CA,Belmont-Redwood Shores Elementary School District,elementary_school_district,2025,researchable,not_researched,,
school_district,0604620,CA,Benicia Unified School District,unified_school_district,2025,researchable,not_researched,,
school_district,0604650,CA,Bennett Valley Union Elementary School District,elementary_school_district,2025,researchable,not_researched,,
school_district,0604740,CA,Berkeley Unified School District,unified_school_district,2025,researchable,not_researched,,
school_district,0604800,CA,Berryessa Union Elementary School District,elementary_school_district,2025,researchable,not_researched,,
school_district,0604830,CA,Beverly Hills Unified School District,unified_school_district,2025,researchable,not_researched,,
school_district,0604860,CA,Big Creek Elementary School District,elementary_school_district,2025,researchable,not_researched,,
school_district,0604890,CA,Big Lagoon Union Elementary School District,elementary_school_district,2025,researchable,not_researched,,
school_district,0604950,CA,Big Pine Unified School District,unified_school_district,2025,researchable,not_researched,,
school_district,0604980,CA,Big Springs Union Elementary School District,elementary_school_district,2025,researchable,not_researched,,
school_district,0605010,CA,Big Valley Joint Unified School District,unified_school_district,2025,researchable,not_researched,,
school_district,0605040,CA,Biggs Unified School District,unified_school_district,2025,researchable,not_researched,,
school_district,0605190,CA,Bitterwater-Tully Union Elementary School District,elementary_school_district,2025,researchable,not_researched,,
school_district,0605220,CA,Black Butte Union Elementary School District,elementary_school_district,2025,researchable,not_researched,,
school_district,0605240,CA,Black Oak Mine Unified School District,unified_school_district,2025,researchable,not_researched,,
school_district,0605250,CA,Blake Elementary School District,elementary_school_district,2025,researchable,not_researched,,
school_district,0605280,CA,Blochman Union Elementary School District,elementary_school_district,2025,researchable,not_researched,,
school_district,0605400,CA,Blue Lake Union Elementary School District,elementary_school_district,2025,researchable,not_researched,,
school_district,0605490,CA,Bogus Elementary School District,elementary_school_district,2025,researchable,not_researched,,
school_district,0605520,CA,Bolinas-Stinson Union Elementary School District,elementary_school_district,2025,researchable,not_researched,,
school_district,0605580,CA,Santa Maria-Bonita Elementary School District,elementary_school_district,2025,researchable,not_researched,,
school_district,0605610,CA,Bonita Unified School District,unified_school_district,2025,researchable,not_researched,,
school_district,0605640,CA,Bonny Doon Union Elementary School District,elementary_school_district,2025,researchable,not_researched,,
school_district,0605700,CA,Borrego Springs Unified School District,unified_school_district,2025,researchable,not_researched,,
school_district,0605730,CA,Bradley Union Elementary School District,elementary_school_district,2025,researchable,not_researched,,
school_district,0605790,CA,Brawley Elementary School District,elementary_school_district,2025,researchable,not_researched,,
school_district,0605820,CA,Brawley Union High School District,secondary_school_district,2025,researchable,not_researched,,
school_district,0605880,CA,Brea-Olinda Unified School District,unified_school_district,2025,researchable,not_researched,,
school_district,0605910,CA,Brentwood Union Elementary School District,elementary_school_district,2025,researchable,not_researched,,
school_district,0605940,CA,Bret Harte Union High School District,secondary_school_district,2025,researchable,not_researched,,
school_district,0606000,CA,Bridgeville Elementary School District,elementary_school_district,2025,researchable,not_researched,,
school_district,0606001,CA,Yosemite Unified School District (9-12),secondary_school_district,2025,researchable,not_researched,,
school_district,0606003,CA,Twin Rivers Unified School District (9-12),secondary_school_district,2025,researchable,not_researched,,
school_district,0606004,CA,Twin Rivers Unified School District (7-12),secondary_school_district,2025,researchable,not_researched,,
school_district,0606005,CA,Scott Valley Unified School District (9-12),secondary_school_district,2025,researchable,not_researched,,
school_district,0606006,CA,Trinity Alps Unified School District (9-12),secondary_school_district,2025,researchable,not_researched,,
school_district,0606013,CA,Turlock Unified School District (9-12),secondary_school_district,2025,researchable,not_researched,,
school_district,0606015,CA,Santa Cruz City High School District (9-12),secondary_school_district,2025,researchable,not_researched,,
school_district,0606016,CA,Dinuba Unified School District (9-12),secondary_school_district,2025,researchable,not_researched,,
school_district,0606018,CA,Washington Unified School District (9-12),secondary_school_district,2025,researchable,not_researched,,
school_district,0606019,CA,Santa Barbara Unified School District (7-12),secondary_school_district,2025,researchable,not_researched,,
school_district,0606020,CA,Lammersville Joint Unified School District (9-12),secondary_school_district,2025,researchable,not_researched,,
school_district,0606021,CA,Bishop Unified School District (9-12),secondary_school_district,2025,researchable,not_researched,,
school_district,0606022,CA,Santa Paula Unified School District (9-12),secondary_school_district,2025,researchable,not_researched,,
school_district,0606025,CA,Hamilton Unified School District (9-12),secondary_school_district,2025,researchable,not_researched,,
school_district,0606026,CA,Woodlake Unified School District (9-12),secondary_school_district,2025,researchable,not_researched,,
school_district,0606028,CA,Exeter Unified School District (9-12),secondary_school_district,2025,researchable,not_researched,,
school_district,0606030,CA,Briggs Elementary School District,elementary_school_district,2025,researchable,not_researched,,
school_district,0606031,CA,Tracy Unified School District (9-12),secondary_school_district,2025,researchable,not_researched,,
school_district,0606034,CA,Perris Union High School District (9-12),secondary_school_district,2025,researchable,not_researched,,
school_district,0606037,CA,Alhambra Unified School District (9-12),secondary_school_district,2025,researchable,not_researched,,
school_district,0606038,CA,Healdsburg Unified School District (7-12),secondary_school_district,2025,researchable,not_researched,,
school_district,0606053,CA,Gonzales Unified School District (9-12),secondary_school_district,2025,researchable,not_researched,,
school_district,0606060,CA,Brisbane Elementary School District,elementary_school_district,2025,researchable,not_researched,,
school_district,0606090,CA,Brittan Elementary School District,elementary_school_district,2025,researchable,not_researched,,
school_district,0606100,CA,Browns Elementary School District,elementary_school_district,2025,researchable,not_researched,,
school_district,0606107,CA,Porterville Unified School District (9-12),secondary_school_district,2025,researchable,not_researched,,
school_district,0606270,CA,Buckeye Union Elementary School District,elementary_school_district,2025,researchable,not_researched,,
school_district,0606330,CA,Buellton Union Elementary School District,elementary_school_district,2025,researchable,not_researched,,
school_district,0606360,CA,Buena Park Elementary School District,elementary_school_district,2025,researchable,not_researched,,
school_district,0606390,CA,Panama-Buena Vista School District,elementary_school_district,2025,researchable,not_researched,,
school_district,0606420,CA,Buena Vista Elementary School District,elementary_school_district,2025,researchable,not_researched,,
school_district,0606450,CA,Burbank Unified School District,unified_school_district,2025,researchable,candidate_found,2026-07-16,1 reviewed source link(s)
school_district,0606480,CA,Burlingame Elementary School District,elementary_school_district,2025,researchable,not_researched,,
school_district,0606510,CA,Burnt Ranch Elementary School District,elementary_school_district,2025,researchable,not_researched,,
school_district,0606540,CA,Burrel Union Elementary School District,elementary_school_district,2025,researchable,not_researched,,
school_district,0606570,CA,Burton Elementary School District,elementary_school_district,2025,researchable,not_researched,,
school_district,0606580,CA,Butte Valley Unified School District,unified_school_district,2025,researchable,not_researched,,
school_district,0606690,CA,Butteville Union Elementary School District,elementary_school_district,2025,researchable,not_researched,,
school_district,0606720,CA,Buttonwillow Union Elementary School District,elementary_school_district,2025,researchable,not_researched,,
school_district,0606750,CA,Byron Union Elementary School District,elementary_school_district,2025,researchable,not_researched,,
school_district,0606780,CA,Cabrillo Unified School District,unified_school_district,2025,researchable,not_researched,,
school_district,0606810,CA,Cajon Valley Union Elementary School District,elementary_school_district,2025,researchable,not_researched,,
school_district,0606870,CA,Calaveras Unified School District,unified_school_district,2025,researchable,not_researched,,
school_district,0606900,CA,Calexico Unified School District,unified_school_district,2025,researchable,not_researched,,
school_district,0606960,CA,Caliente Union Elementary School District,elementary_school_district,2025,researchable,not_researched,,
school_district,0606990,CA,Calipatria Unified School District,unified_school_district,2025,researchable,not_researched,,
school_district,0607020,CA,Calistoga Joint Unified School District,unified_school_district,2025,researchable,not_researched,,
school_district,0607140,CA,Cambrian Elementary School District,elementary_school_district,2025,researchable,not_researched,,
