entity_namespace,geoid,state,entity_name,entity_kind,universe_vintage,entity_disposition,research_status,last_checked_on,notes
school_district,4810140,TX,Big Sandy Independent School District,unified_school_district,2025,researchable,not_researched,,
school_district,4810170,TX,Big Sandy Independent School District,unified_school_district,2025,researchable,not_researched,,
school_district,4810200,TX,Big Spring Independent School District,unified_school_district,2025,researchable,not_researched,,
school_district,4810230,TX,Birdville Independent School District,unified_school_district,2025,researchable,not_researched,,
school_district,4810260,TX,Bishop Consolidated Independent School District,unified_school_district,2025,researchable,not_researched,,
school_district,4810320,TX,Blanco Independent School District,unified_school_district,2025,researchable,not_researched,,
school_district,4810350,TX,Bland Independent School District,unified_school_district,2025,researchable,not_researched,,
school_district,4810380,TX,Blanket Independent School District,unified_school_district,2025,researchable,not_researched,,
school_district,4810440,TX,Bloomburg Independent School District,unified_school_district,2025,researchable,not_researched,,
school_district,4810470,TX,Blooming Grove Independent School District,unified_school_district,2025,researchable,not_researched,,
school_district,4810500,TX,Bloomington Independent School District,unified_school_district,2025,researchable,not_researched,,
school_district,4810590,TX,Blue Ridge Independent School District,unified_school_district,2025,researchable,not_researched,,
school_district,4810620,TX,Bluff Dale Independent School District,unified_school_district,2025,researchable,not_researched,,
school_district,4810650,TX,Blum Independent School District,unified_school_district,2025,researchable,not_researched,,
school_district,4810710,TX,Boerne Independent School District,unified_school_district,2025,researchable,not_researched,,
school_district,4810740,TX,Boles Independent School District,unified_school_district,2025,researchable,not_researched,,
school_district,4810780,TX,Boling Independent School District,unified_school_district,2025,researchable,not_researched,,
school_district,4810800,TX,Bonham Independent School District,unified_school_district,2025,researchable,not_researched,,
school_district,4810830,TX,Booker Independent School District,unified_school_district,2025,researchable,not_researched,,
school_district,4810860,TX,Borden County Independent School District,unified_school_district,2025,researchable,not_researched,,
school_district,4810890,TX,Borger Independent School District,unified_school_district,2025,researchable,not_researched,,
school_district,4810910,TX,Bosqueville Independent School District,unified_school_district,2025,researchable,not_researched,,
school_district,4810950,TX,Bovina Independent School District,unified_school_district,2025,researchable,not_researched,,
school_district,4810990,TX,Bowie Independent School District,unified_school_district,2025,researchable,not_researched,,
school_district,4811010,TX,Boyd Independent School District,unified_school_district,2025,researchable,not_researched,,
school_district,4811040,TX,Boys Ranch Independent School District,unified_school_district,2025,researchable,not_researched,,
school_district,4811070,TX,Brackett Independent School District,unified_school_district,2025,researchable,not_researched,,
school_district,4811110,TX,Brady Independent School District,unified_school_district,2025,researchable,not_researched,,
school_district,4811190,TX,Brazosport Independent School District,unified_school_district,2025,researchable,not_researched,,
school_district,4811220,TX,Breckenridge Independent School District,unified_school_district,2025,researchable,not_researched,,
school_district,4811250,TX,Bremond Independent School District,unified_school_district,2025,researchable,not_researched,,
school_district,4811280,TX,Brenham Independent School District,unified_school_district,2025,researchable,not_researched,,
school_district,4811310,TX,Bridge City Independent School District,unified_school_district,2025,researchable,not_researched,,
school_district,4811340,TX,Bridgeport Independent School District,unified_school_district,2025,researchable,not_researched,,
school_district,4811400,TX,Fort Elliott Consolidated Independent School District,unified_school_district,2025,researchable,not_researched,,
school_district,4811430,TX,Broaddus Independent School District,unified_school_district,2025,researchable,not_researched,,
school_district,4811460,TX,Brock Independent School District,unified_school_district,2025,researchable,not_researched,,
school_district,4811490,TX,Bronte Independent School District,unified_school_district,2025,researchable,not_researched,,
school_district,4811520,TX,Brookeland Independent School District,unified_school_district,2025,researchable,not_researched,,
school_district,4811550,TX,Brookesmith Independent School District,unified_school_district,2025,researchable,not_researched,,
school_district,4811580,TX,Brooks County Independent School District,unified_school_district,2025,researchable,not_researched,,
school_district,4811610,TX,Brownfield Independent School District,unified_school_district,2025,researchable,not_researched,,
school_district,4811640,TX,Brownsboro Independent School District,unified_school_district,2025,researchable,not_researched,,
school_district,4811680,TX,Brownsville Independent School District,unified_school_district,2025,researchable,not_researched,,
school_district,4811700,TX,Brownwood Independent School District,unified_school_district,2025,researchable,not_researched,,
school_district,4811730,TX,Bruceville-Eddy Independent School District,unified_school_district,2025,researchable,not_researched,,
school_district,4811790,TX,Bryan Independent School District,unified_school_district,2025,researchable,not_researched,,
school_district,4811820,TX,Bryson Independent School District,unified_school_district,2025,researchable,not_researched,,
school_district,4811850,TX,Buckholts Independent School District,unified_school_district,2025,researchable,not_researched,,
school_district,4811910,TX,Buena Vista Independent School District,unified_school_district,2025,researchable,not_researched,,
school_district,4811990,TX,Buffalo Independent School District,unified_school_district,2025,researchable,not_researched,,
school_district,4812060,TX,Bullard Independent School District,unified_school_district,2025,researchable,not_researched,,
school_district,4812090,TX,Buna Independent School District,unified_school_district,2025,researchable,not_researched,,
school_district,4812120,TX,Burkburnett Independent School District,unified_school_district,2025,researchable,not_researched,,
school_district,4812150,TX,Burkeville Independent School District,unified_school_district,2025,researchable,not_researched,,
school_district,4812180,TX,Burleson Independent School District,unified_school_district,2025,researchable,not_researched,,
school_district,4812220,TX,Burnet Consolidated Independent School District,unified_school_district,2025,researchable,not_researched,,
school_district,4812240,TX,Burton Independent School District,unified_school_district,2025,researchable,not_researched,,
school_district,4812360,TX,Bynum Independent School District,unified_school_district,2025,researchable,not_researched,,
school_district,4812390,TX,Caddo Mills Independent School District,unified_school_district,2025,researchable,not_researched,,
school_district,4812420,TX,Calallen Independent School District,unified_school_district,2025,researchable,not_researched,,
school_district,4812460,TX,Caldwell Independent School District,unified_school_district,2025,researchable,not_researched,,
school_district,4812480,TX,Calhoun County Independent School District,unified_school_district,2025,researchable,not_researched,,
school_district,4812510,TX,Callisburg Independent School District,unified_school_district,2025,researchable,not_researched,,
school_district,4812540,TX,Calvert Independent School District,unified_school_district,2025,researchable,not_researched,,
school_district,4812640,TX,Cameron Independent School District,unified_school_district,2025,researchable,not_researched,,
school_district,4812660,TX,Campbell Independent School District,unified_school_district,2025,researchable,not_researched,,
school_district,4812700,TX,Canadian Independent School District,unified_school_district,2025,researchable,not_researched,,
school_district,4812750,TX,Canton Independent School District,unified_school_district,2025,researchable,not_researched,,
school_district,4812780,TX,Canutillo Independent School District,unified_school_district,2025,researchable,not_researched,,
school_district,4812810,TX,Canyon Independent School District,unified_school_district,2025,researchable,not_researched,,
school_district,4812870,TX,Carlisle Independent School District,unified_school_district,2025,researchable,not_researched,,
school_district,4812990,TX,Carrizo Springs Consolidated Independent School District,unified_school_district,2025,researchable,not_researched,,
school_district,4813020,TX,Carroll Independent School District,unified_school_district,2025,researchable,not_researched,,
school_district,4813050,TX,Carrollton-Farmers Branch Independent School District,unified_school_district,2025,researchable,not_researched,,
school_district,4813110,TX,Carthage Independent School District,unified_school_district,2025,researchable,not_researched,,
school_district,4813170,TX,Castleberry Independent School District,unified_school_district,2025,researchable,not_researched,,
school_district,4813200,TX,Cayuga Independent School District,unified_school_district,2025,researchable,not_researched,,
school_district,4813230,TX,Cedar Hill Independent School District,unified_school_district,2025,researchable,not_researched,,
school_district,4813260,TX,Celeste Independent School District,unified_school_district,2025,researchable,not_researched,,
school_district,4813290,TX,Celina Independent School District,unified_school_district,2025,researchable,not_researched,,
school_district,4813320,TX,Center Independent School District,unified_school_district,2025,researchable,not_researched,,
school_district,4813350,TX,Center Point Independent School District,unified_school_district,2025,researchable,not_researched,,
school_district,4813380,TX,Centerville Independent School District,unified_school_district,2025,researchable,not_researched,,
school_district,4813410,TX,Centerville Independent School District,unified_school_district,2025,researchable,not_researched,,
school_district,4813440,TX,Central Heights Independent School District,unified_school_district,2025,researchable,not_researched,,
school_district,4813500,TX,Central Independent School District,unified_school_district,2025,researchable,not_researched,,
school_district,4813530,TX,Lumberton Independent School District,unified_school_district,2025,researchable,not_researched,,
school_district,4813590,TX,Channelview Independent School District,unified_school_district,2025,researchable,not_researched,,
school_district,4813620,TX,Channing Independent School District,unified_school_district,2025,researchable,not_researched,,
school_district,4813650,TX,Chapel Hill Independent School District,unified_school_district,2025,researchable,not_researched,,
school_district,4813680,TX,Chapel Hill Independent School District,unified_school_district,2025,researchable,not_researched,,
school_district,4813710,TX,Charlotte Independent School District,unified_school_district,2025,researchable,not_researched,,
school_district,4813740,TX,Cherokee Independent School District,unified_school_district,2025,researchable,not_researched,,
school_district,4813770,TX,Chester Independent School District,unified_school_district,2025,researchable,not_researched,,
school_district,4813800,TX,Chico Independent School District,unified_school_district,2025,researchable,not_researched,,
school_district,4813860,TX,Childress Independent School District,unified_school_district,2025,researchable,not_researched,,
school_district,4813890,TX,Chillicothe Independent School District,unified_school_district,2025,researchable,not_researched,,
school_district,4813920,TX,Chilton Independent School District,unified_school_district,2025,researchable,not_researched,,
school_district,4813960,TX,China Spring Independent School District,unified_school_district,2025,researchable,not_researched,,
school_district,4813980,TX,Chireno Independent School District,unified_school_district,2025,researchable,not_researched,,
school_district,4814010,TX,Christoval Independent School District,unified_school_district,2025,researchable,not_researched,,
school_district,4814070,TX,Cisco Independent School District,unified_school_district,2025,researchable,not_researched,,
school_district,4814130,TX,City View Independent School District,unified_school_district,2025,researchable,not_researched,,
school_district,4814160,TX,Clarendon Independent School District,unified_school_district,2025,researchable,not_researched,,
school_district,4814190,TX,Clarksville Independent School District,unified_school_district,2025,researchable,not_researched,,
school_district,4814250,TX,Claude Independent School District,unified_school_district,2025,researchable,not_researched,,
school_district,4814280,TX,Clear Creek Independent School District,unified_school_district,2025,researchable,not_researched,,
school_district,4814310,TX,Cleburne Independent School District,unified_school_district,2025,researchable,not_researched,,
school_district,4814370,TX,Cleveland Independent School District,unified_school_district,2025,researchable,not_researched,,
school_district,4814400,TX,Clifton Independent School District,unified_school_district,2025,researchable,not_researched,,
school_district,4814430,TX,Clint Independent School District,unified_school_district,2025,researchable,not_researched,,
school_district,4814450,TX,Clyde Consolidated Independent School District,unified_school_district,2025,researchable,not_researched,,
school_district,4814490,TX,Coahoma Independent School District,unified_school_district,2025,researchable,not_researched,,
school_district,4814520,TX,Coldspring-Oakhurst Consolidated Independent School District,unified_school_district,2025,researchable,not_researched,,
school_district,4814550,TX,Coleman Independent School District,unified_school_district,2025,researchable,not_researched,,
school_district,4814580,TX,Collinsville Independent School District,unified_school_district,2025,researchable,not_researched,,
school_district,4814600,TX,Colmesneil Independent School District,unified_school_district,2025,researchable,not_researched,,
school_district,4814640,TX,Colorado Independent School District,unified_school_district,2025,researchable,not_researched,,
school_district,4814670,TX,Columbia-Brazoria Independent School District,unified_school_district,2025,researchable,not_researched,,
school_district,4814700,TX,Columbus Independent School District,unified_school_district,2025,researchable,not_researched,,
school_district,4814730,TX,Comal Independent School District,unified_school_district,2025,researchable,not_researched,,
school_district,4814760,TX,Comanche Independent School District,unified_school_district,2025,researchable,not_researched,,
school_district,4814790,TX,Comfort Independent School District,unified_school_district,2025,researchable,not_researched,,
school_district,4814820,TX,Commerce Independent School District,unified_school_district,2025,researchable,not_researched,,
school_district,4814850,TX,Community Independent School District,unified_school_district,2025,researchable,not_researched,,
school_district,4814880,TX,Como-Pickton Consolidated Independent School District,unified_school_district,2025,researchable,not_researched,,
school_district,4814920,TX,Comstock Independent School District,unified_school_district,2025,researchable,not_researched,,
school_district,4814970,TX,Connally Independent School District,unified_school_district,2025,researchable,not_researched,,
school_district,4815000,TX,Conroe Independent School District,unified_school_district,2025,researchable,not_researched,,
school_district,4815120,TX,Coolidge Independent School District,unified_school_district,2025,researchable,not_researched,,
school_district,4815150,TX,Cooper Independent School District,unified_school_district,2025,researchable,not_researched,,
school_district,4815180,TX,Lubbock-Cooper Independent School District,unified_school_district,2025,researchable,not_researched,,
school_district,4815210,TX,Coppell Independent School District,unified_school_district,2025,researchable,not_researched,,
school_district,4815240,TX,Copperas Cove Independent School District,unified_school_district,2025,researchable,not_researched,,
school_district,4815270,TX,Corpus Christi Independent School District,unified_school_district,2025,researchable,not_researched,,
school_district,4815300,TX,Corrigan-Camden Independent School District,unified_school_district,2025,researchable,not_researched,,
school_district,4815330,TX,Corsicana Independent School District,unified_school_district,2025,researchable,not_researched,,
school_district,4815360,TX,Cotton Center Independent School District,unified_school_district,2025,researchable,not_researched,,
school_district,4815400,TX,Cotulla Independent School District,unified_school_district,2025,researchable,not_researched,,
school_district,4815420,TX,Coupland Independent School District,unified_school_district,2025,researchable,not_researched,,
school_district,4815480,TX,Covington Independent School District,unified_school_district,2025,researchable,not_researched,,
school_district,4815510,TX,Crandall Independent School District,unified_school_district,2025,researchable,not_researched,,
school_district,4815540,TX,Crane Independent School District,unified_school_district,2025,researchable,not_researched,,
school_district,4815570,TX,Cranfills Gap Independent School District,unified_school_district,2025,researchable,not_researched,,
school_district,4815600,TX,Crawford Independent School District,unified_school_district,2025,researchable,not_researched,,
school_district,4815690,TX,Crockett County Consolidated Common School District,unified_school_district,2025,researchable,not_researched,,
school_district,4815720,TX,Crockett Independent School District,unified_school_district,2025,researchable,not_researched,,
school_district,4815750,TX,Crosby Independent School District,unified_school_district,2025,researchable,not_researched,,
school_district,4815810,TX,Cross Plains Independent School District,unified_school_district,2025,researchable,not_researched,,
school_district,4815840,TX,Cross Roads Independent School District,unified_school_district,2025,researchable,not_researched,,
school_district,4815870,TX,Crowell Independent School District,unified_school_district,2025,researchable,not_researched,,
school_district,4815910,TX,Crowley Independent School District,unified_school_district,2025,researchable,not_researched,,
school_district,4815930,TX,Crystal City Independent School District,unified_school_district,2025,researchable,candidate_found,2026-07-16,1 reviewed source link(s)
school_district,4815960,TX,Cuero Independent School District,unified_school_district,2025,researchable,not_researched,,
school_district,4815990,TX,Culberson County-Allamoore Independent School District,unified_school_district,2025,researchable,not_researched,,
school_district,4816020,TX,Cumby Collegiate Independent School District,unified_school_district,2025,researchable,not_researched,,
school_district,4816080,TX,Cushing Independent School District,unified_school_district,2025,researchable,not_researched,,
school_district,4816110,TX,Cypress-Fairbanks Independent School District,unified_school_district,2025,researchable,not_researched,,
school_district,4816140,TX,D'Hanis Independent School District,unified_school_district,2025,researchable,not_researched,,
school_district,4816180,TX,Daingerfield-Lone Star Independent School District,unified_school_district,2025,researchable,not_researched,,
school_district,4816200,TX,Dalhart Independent School District,unified_school_district,2025,researchable,not_researched,,
school_district,4816230,TX,Dallas Independent School District,unified_school_district,2025,researchable,candidate_found,2026-07-15,1 reviewed source link(s)
school_district,4816260,TX,Damon Independent School District,unified_school_district,2025,researchable,not_researched,,
school_district,4816290,TX,Danbury Independent School District,unified_school_district,2025,researchable,not_researched,,
school_district,4816320,TX,Darrouzett Independent School District,unified_school_district,2025,researchable,not_researched,,
school_district,4816350,TX,Dawson Independent School District,unified_school_district,2025,researchable,not_researched,,
school_district,4816380,TX,Dawson Independent School District,unified_school_district,2025,researchable,not_researched,,
school_district,4816410,TX,Dayton Independent School District,unified_school_district,2025,researchable,not_researched,,
school_district,4816440,TX,De Leon Independent School District,unified_school_district,2025,researchable,not_researched,,
school_district,4816500,TX,Decatur Independent School District,unified_school_district,2025,researchable,not_researched,,
school_district,4816530,TX,Deer Park Independent School District,unified_school_district,2025,researchable,not_researched,,
school_district,4816570,TX,DeKalb Independent School District,unified_school_district,2025,researchable,not_researched,,
school_district,4816620,TX,Del Valle Independent School District,unified_school_district,2025,researchable,not_researched,,
school_district,4816650,TX,Dell City Independent School District,unified_school_district,2025,researchable,not_researched,,
school_district,4816710,TX,Denison Independent School District,unified_school_district,2025,researchable,not_researched,,
school_district,4816740,TX,Denton Independent School District,unified_school_district,2025,researchable,not_researched,,
school_district,4816770,TX,Denver City Independent School District,unified_school_district,2025,researchable,not_researched,,
school_district,4816860,TX,DeSoto Independent School District,unified_school_district,2025,researchable,not_researched,,
school_district,4816890,TX,Detroit Independent School District,unified_school_district,2025,researchable,not_researched,,
school_district,4816920,TX,Devers Independent School District,unified_school_district,2025,researchable,not_researched,,
school_district,4816950,TX,Devine Independent School District,unified_school_district,2025,researchable,not_researched,,
school_district,4816980,TX,Dew Independent School District,unified_school_district,2025,researchable,not_researched,,
school_district,4817010,TX,Deweyville Independent School District,unified_school_district,2025,researchable,not_researched,,
school_district,4817040,TX,Diboll Independent School District,unified_school_district,2025,researchable,not_researched,,
school_district,4817070,TX,Dickinson Independent School District,unified_school_district,2025,researchable,not_researched,,
school_district,4817100,TX,Dilley Independent School District,unified_school_district,2025,researchable,not_researched,,
school_district,4817130,TX,Dime Box Independent School District,unified_school_district,2025,researchable,not_researched,,
school_district,4817160,TX,Dimmitt Independent School District,unified_school_district,2025,researchable,not_researched,,
school_district,4817190,TX,Divide Independent School District,unified_school_district,2025,researchable,not_researched,,
school_district,4817280,TX,Dodd City Independent School District,unified_school_district,2025,researchable,not_researched,,
school_district,4817390,TX,Donna Independent School District,unified_school_district,2025,researchable,not_researched,,
school_district,4817400,TX,Doss Consolidated Common School District,unified_school_district,2025,researchable,not_researched,,
school_district,4817460,TX,Douglass Independent School District,unified_school_district,2025,researchable,not_researched,,
school_district,4817550,TX,Driscoll Independent School District,unified_school_district,2025,researchable,not_researched,,
school_district,4817580,TX,Dublin Independent School District,unified_school_district,2025,researchable,not_researched,,
school_district,4817610,TX,Dumas Independent School District,unified_school_district,2025,researchable,not_researched,,
school_district,4817640,TX,Duncanville Independent School District,unified_school_district,2025,researchable,not_researched,,
school_district,4817700,TX,Eagle Mountain-Saginaw Independent School District,unified_school_district,2025,researchable,not_researched,,
school_district,4817730,TX,Eagle Pass Independent School District,unified_school_district,2025,researchable,not_researched,,
school_district,4817760,TX,Eanes Independent School District,unified_school_district,2025,researchable,not_researched,,
school_district,4817790,TX,Early Independent School District,unified_school_district,2025,researchable,not_researched,,
school_district,4817830,TX,East Bernard Independent School District,unified_school_district,2025,researchable,not_researched,,
school_district,4817850,TX,East Central Independent School District,unified_school_district,2025,researchable,not_researched,,
school_district,4817880,TX,East Chambers Independent School District,unified_school_district,2025,researchable,not_researched,,
school_district,4817960,TX,Eastland Independent School District,unified_school_district,2025,researchable,not_researched,,
school_district,4818000,TX,Ector County Independent School District,unified_school_district,2025,researchable,not_researched,,
