entity_namespace,geoid,state,entity_name,entity_kind,universe_vintage,entity_disposition,research_status,last_checked_on,notes
school_district,4818030,TX,Ector Independent School District,unified_school_district,2025,researchable,not_researched,,
school_district,4818060,TX,Edcouch-Elsa Independent School District,unified_school_district,2025,researchable,not_researched,,
school_district,4818070,TX,Eden Consolidated Independent School District,unified_school_district,2025,researchable,not_researched,,
school_district,4818120,TX,Edgewood Independent School District,unified_school_district,2025,researchable,not_researched,,
school_district,4818150,TX,Edgewood Independent School District,unified_school_district,2025,researchable,not_researched,,
school_district,4818180,TX,Edinburg Consolidated Independent School District,unified_school_district,2025,researchable,not_researched,,
school_district,4818210,TX,Edna Independent School District,unified_school_district,2025,researchable,not_researched,,
school_district,4818280,TX,El Campo Independent School District,unified_school_district,2025,researchable,not_researched,,
school_district,4818300,TX,El Paso Independent School District,unified_school_district,2025,researchable,not_researched,,
school_district,4818330,TX,Electra Independent School District,unified_school_district,2025,researchable,not_researched,,
school_district,4818360,TX,Elgin Independent School District,unified_school_district,2025,researchable,not_researched,,
school_district,4818390,TX,Elkhart Independent School District,unified_school_district,2025,researchable,not_researched,,
school_district,4818480,TX,Elysian Fields Independent School District,unified_school_district,2025,researchable,not_researched,,
school_district,4818540,TX,Ennis Independent School District,unified_school_district,2025,researchable,not_researched,,
school_district,4818600,TX,Era Independent School District,unified_school_district,2025,researchable,not_researched,,
school_district,4818690,TX,Eula Independent School District,unified_school_district,2025,researchable,not_researched,,
school_district,4818720,TX,Eustace Independent School District,unified_school_district,2025,researchable,not_researched,,
school_district,4818750,TX,Evadale Independent School District,unified_school_district,2025,researchable,not_researched,,
school_district,4818780,TX,Evant Independent School District,unified_school_district,2025,researchable,not_researched,,
school_district,4818810,TX,Everman Independent School District,unified_school_district,2025,researchable,not_researched,,
school_district,4818840,TX,Excelsior Independent School District,unified_school_district,2025,researchable,not_researched,,
school_district,4818890,TX,Ezzell Independent School District,unified_school_district,2025,researchable,not_researched,,
school_district,4818900,TX,Fabens Independent School District,unified_school_district,2025,researchable,not_researched,,
school_district,4818940,TX,Fairfield Independent School District,unified_school_district,2025,researchable,not_researched,,
school_district,4819020,TX,Falls City Independent School District,unified_school_district,2025,researchable,not_researched,,
school_district,4819050,TX,Fannindel Independent School District,unified_school_district,2025,researchable,not_researched,,
school_district,4819080,TX,Farmersville Independent School District,unified_school_district,2025,researchable,not_researched,,
school_district,4819110,TX,Farwell Independent School District,unified_school_district,2025,researchable,not_researched,,
school_district,4819140,TX,Fayetteville Independent School District,unified_school_district,2025,researchable,not_researched,,
school_district,4819170,TX,Ferris Independent School District,unified_school_district,2025,researchable,not_researched,,
school_district,4819280,TX,Flatonia Independent School District,unified_school_district,2025,researchable,not_researched,,
school_district,4819320,TX,Florence Independent School District,unified_school_district,2025,researchable,not_researched,,
school_district,4819350,TX,Floresville Independent School District,unified_school_district,2025,researchable,not_researched,,
school_district,4819380,TX,Flour Bluff Independent School District,unified_school_district,2025,researchable,not_researched,,
school_district,4819440,TX,Floydada Collegiate Independent School District,unified_school_district,2025,researchable,not_researched,,
school_district,4819500,TX,Follett Independent School District,unified_school_district,2025,researchable,not_researched,,
school_district,4819530,TX,Forestburg Independent School District,unified_school_district,2025,researchable,not_researched,,
school_district,4819560,TX,Forney Independent School District,unified_school_district,2025,researchable,not_researched,,
school_district,4819620,TX,Forsan Independent School District,unified_school_district,2025,researchable,not_researched,,
school_district,4819650,TX,Fort Bend Independent School District,unified_school_district,2025,researchable,not_researched,,
school_district,4819700,TX,Fort Worth Independent School District,unified_school_district,2025,researchable,not_researched,,
school_district,4819740,TX,Franklin Independent School District,unified_school_district,2025,researchable,not_researched,,
school_district,4819770,TX,Frankston Independent School District,unified_school_district,2025,researchable,not_researched,,
school_district,4819820,TX,Freer Independent School District,unified_school_district,2025,researchable,not_researched,,
school_district,4819830,TX,Frenship Independent School District,unified_school_district,2025,researchable,not_researched,,
school_district,4819840,TX,Fredericksburg Independent School District,unified_school_district,2025,researchable,not_researched,,
school_district,4819950,TX,Friendswood Independent School District,unified_school_district,2025,researchable,not_researched,,
school_district,4819980,TX,Friona Independent School District,unified_school_district,2025,researchable,not_researched,,
