entity_namespace,geoid,state,entity_name,entity_kind,universe_vintage,entity_disposition,research_status,last_checked_on,notes
school_district,4827570,TX,Lindsay Independent School District,unified_school_district,2025,researchable,not_researched,,
school_district,4827600,TX,Lingleville Independent School District,unified_school_district,2025,researchable,not_researched,,
school_district,4827630,TX,Lipan Independent School District,unified_school_district,2025,researchable,not_researched,,
school_district,4827690,TX,Little Cypress-Mauriceville Consolidated Independent School District,unified_school_district,2025,researchable,not_researched,,
school_district,4827720,TX,Little Elm Independent School District,unified_school_district,2025,researchable,not_researched,,
school_district,4827750,TX,Littlefield Independent School District,unified_school_district,2025,researchable,not_researched,,
school_district,4827780,TX,Livingston Independent School District,unified_school_district,2025,researchable,not_researched,,
school_district,4827810,TX,Llano Independent School District,unified_school_district,2025,researchable,not_researched,,
school_district,4827870,TX,Lockhart Independent School District,unified_school_district,2025,researchable,not_researched,,
school_district,4827890,TX,Lockney Independent School District,unified_school_district,2025,researchable,not_researched,,
school_district,4827930,TX,Lohn Independent School District,unified_school_district,2025,researchable,not_researched,,
school_district,4827960,TX,Lometa Independent School District,unified_school_district,2025,researchable,not_researched,,
school_district,4827990,TX,London Independent School District,unified_school_district,2025,researchable,not_researched,,
school_district,4828020,TX,Lone Oak Independent School District,unified_school_district,2025,researchable,not_researched,,
school_district,4828110,TX,Longview Independent School District,unified_school_district,2025,researchable,not_researched,,
school_district,4828140,TX,Loop Independent School District,unified_school_district,2025,researchable,not_researched,,
school_district,4828170,TX,Loraine Independent School District,unified_school_district,2025,researchable,not_researched,,
school_district,4828200,TX,Lorena Independent School District,unified_school_district,2025,researchable,not_researched,,
school_district,4828230,TX,Lorenzo Independent School District,unified_school_district,2025,researchable,not_researched,,
school_district,4828290,TX,Los Fresnos Consolidated Independent School District,unified_school_district,2025,researchable,not_researched,,
school_district,4828350,TX,Louise Independent School District,unified_school_district,2025,researchable,not_researched,,
school_district,4828380,TX,Lovejoy Independent School District,unified_school_district,2025,researchable,not_researched,,
school_district,4828410,TX,Lovelady Independent School District,unified_school_district,2025,researchable,not_researched,,
school_district,4828500,TX,Lubbock Independent School District,unified_school_district,2025,researchable,not_researched,,
school_district,4828530,TX,Lueders-Avoca Independent School District,unified_school_district,2025,researchable,not_researched,,
school_district,4828550,TX,Lufkin Independent School District,unified_school_district,2025,researchable,not_researched,,
school_district,4828590,TX,Luling Independent School District,unified_school_district,2025,researchable,not_researched,,
school_district,4828620,TX,Lyford Consolidated Independent School District,unified_school_district,2025,researchable,not_researched,,
school_district,4828650,TX,Lytle Independent School District,unified_school_district,2025,researchable,not_researched,,
school_district,4828680,TX,Mabank Independent School District,unified_school_district,2025,researchable,not_researched,,
school_district,4828710,TX,Madisonville Consolidated Independent School District,unified_school_district,2025,researchable,not_researched,,
school_district,4828740,TX,Magnolia Independent School District,unified_school_district,2025,researchable,not_researched,,
school_district,4828780,TX,Malakoff Independent School District,unified_school_district,2025,researchable,not_researched,,
school_district,4828800,TX,Malone Independent School District,unified_school_district,2025,researchable,not_researched,,
school_district,4828830,TX,Malta Independent School District,unified_school_district,2025,researchable,not_researched,,
school_district,4828890,TX,Manor Independent School District,unified_school_district,2025,researchable,not_researched,,
school_district,4828920,TX,Mansfield Independent School District,unified_school_district,2025,researchable,not_researched,,
school_district,4828980,TX,Marathon Independent School District,unified_school_district,2025,researchable,not_researched,,
school_district,4829010,TX,Marble Falls Independent School District,unified_school_district,2025,researchable,not_researched,,
school_district,4829040,TX,Marfa Independent School District,unified_school_district,2025,researchable,not_researched,,
school_district,4829100,TX,Marion Independent School District,unified_school_district,2025,researchable,not_researched,,
school_district,4829130,TX,Marlin Independent School District,unified_school_district,2025,researchable,not_researched,,
school_district,4829160,TX,Marshall Independent School District,unified_school_district,2025,researchable,not_researched,,
school_district,4829190,TX,Mart Independent School District,unified_school_district,2025,researchable,not_researched,,
school_district,4829220,TX,Martins Mill Independent School District,unified_school_district,2025,researchable,not_researched,,
school_district,4829250,TX,Martinsville Independent School District,unified_school_district,2025,researchable,not_researched,,
school_district,4829280,TX,Mason Independent School District,unified_school_district,2025,researchable,not_researched,,
school_district,4829370,TX,Matagorda Independent School District,unified_school_district,2025,researchable,not_researched,,
school_district,4829400,TX,Mathis Independent School District,unified_school_district,2025,researchable,not_researched,,
school_district,4829460,TX,Maud Independent School District,unified_school_district,2025,researchable,not_researched,,
school_district,4829520,TX,May Independent School District,unified_school_district,2025,researchable,not_researched,,
school_district,4829580,TX,Maypearl Independent School District,unified_school_district,2025,researchable,not_researched,,
school_district,4829670,TX,McAllen Independent School District,unified_school_district,2025,researchable,not_researched,,
school_district,4829700,TX,McCamey Independent School District,unified_school_district,2025,researchable,not_researched,,
school_district,4829760,TX,McDade Independent School District,unified_school_district,2025,researchable,not_researched,,
school_district,4829820,TX,McGregor Independent School District,unified_school_district,2025,researchable,not_researched,,
school_district,4829850,TX,McKinney Independent School District,unified_school_district,2025,researchable,not_researched,,
school_district,4829880,TX,McLean Independent School District,unified_school_district,2025,researchable,not_researched,,
school_district,4829910,TX,McLeod Independent School District,unified_school_district,2025,researchable,not_researched,,
school_district,4829940,TX,McMullen County Independent School District,unified_school_district,2025,researchable,not_researched,,
