entity_namespace,geoid,state,entity_name,entity_kind,universe_vintage,entity_disposition,research_status,last_checked_on,notes
school_district,4820010,TX,Frisco Independent School District,unified_school_district,2025,researchable,not_researched,,
school_district,4820040,TX,Frost Independent School District,unified_school_district,2025,researchable,not_researched,,
school_district,4820070,TX,Fruitvale Independent School District,unified_school_district,2025,researchable,not_researched,,
school_district,4820100,TX,Fort Davis Independent School District,unified_school_district,2025,researchable,not_researched,,
school_district,4820130,TX,Fort Hancock Independent School District,unified_school_district,2025,researchable,not_researched,,
school_district,4820160,TX,Fort Sam Houston Independent School District,unified_school_district,2025,researchable,not_researched,,
school_district,4820190,TX,Fort Stockton Independent School District,unified_school_district,2025,researchable,not_researched,,
school_district,4820220,TX,Gainesville Independent School District,unified_school_district,2025,researchable,not_researched,,
school_district,4820250,TX,Galena Park Independent School District,unified_school_district,2025,researchable,not_researched,,
school_district,4820280,TX,Galveston Independent School District,unified_school_district,2025,researchable,not_researched,,
school_district,4820310,TX,Ganado Independent School District,unified_school_district,2025,researchable,not_researched,,
school_district,4820340,TX,Garland Independent School District,unified_school_district,2025,researchable,not_researched,,
school_district,4820370,TX,Garner Independent School District,unified_school_district,2025,researchable,not_researched,,
school_district,4820400,TX,Garrison Independent School District,unified_school_district,2025,researchable,not_researched,,
school_district,4820460,TX,Gary Independent School District,unified_school_district,2025,researchable,not_researched,,
school_district,4820500,TX,Gatesville Independent School District,unified_school_district,2025,researchable,not_researched,,
school_district,4820520,TX,Gause Independent School District,unified_school_district,2025,researchable,not_researched,,
school_district,4820550,TX,George West Independent School District,unified_school_district,2025,researchable,not_researched,,
school_district,4820600,TX,Georgetown Independent School District,unified_school_district,2025,researchable,not_researched,,
school_district,4820610,TX,Gholson Independent School District,unified_school_district,2025,researchable,not_researched,,
school_district,4820640,TX,Giddings Independent School District,unified_school_district,2025,researchable,not_researched,,
school_district,4820700,TX,Gilmer Independent School District,unified_school_district,2025,researchable,not_researched,,
school_district,4820760,TX,Gladewater Independent School District,unified_school_district,2025,researchable,not_researched,,
school_district,4820790,TX,Glasscock County Independent School District,unified_school_district,2025,researchable,not_researched,,
school_district,4820850,TX,Glen Rose Independent School District,unified_school_district,2025,researchable,not_researched,,
school_district,4820960,TX,Godley Independent School District,unified_school_district,2025,researchable,not_researched,,
school_district,4820970,TX,Gold-Burg Independent School District,unified_school_district,2025,researchable,not_researched,,
school_district,4821000,TX,Goldthwaite Consolidated Independent School District,unified_school_district,2025,researchable,not_researched,,
school_district,4821030,TX,Goliad Independent School District,unified_school_district,2025,researchable,not_researched,,
school_district,4821060,TX,Gonzales Independent School District,unified_school_district,2025,researchable,not_researched,,
school_district,4821090,TX,Goodrich Independent School District,unified_school_district,2025,researchable,not_researched,,
school_district,4821150,TX,Goose Creek Consolidated Independent School District,unified_school_district,2025,researchable,not_researched,,
school_district,4821180,TX,Gordon Independent School District,unified_school_district,2025,researchable,not_researched,,
school_district,4821270,TX,Gorman Independent School District,unified_school_district,2025,researchable,not_researched,,
school_district,4821300,TX,Grady Independent School District,unified_school_district,2025,researchable,not_researched,,
school_district,4821330,TX,Graford Independent School District,unified_school_district,2025,researchable,not_researched,,
school_district,4821360,TX,Graham Independent School District,unified_school_district,2025,researchable,not_researched,,
school_district,4821390,TX,Granbury Independent School District,unified_school_district,2025,researchable,not_researched,,
school_district,4821420,TX,Grand Prairie Independent School District,unified_school_district,2025,researchable,not_researched,,
school_district,4821450,TX,Grand Saline Independent School District,unified_school_district,2025,researchable,not_researched,,
school_district,4821480,TX,Grandfalls-Royalty Independent School District,unified_school_district,2025,researchable,not_researched,,
school_district,4821540,TX,Grandview Independent School District,unified_school_district,2025,researchable,not_researched,,
school_district,4821560,TX,Grandview-Hopkins Independent School District,unified_school_district,2025,researchable,not_researched,,
school_district,4821590,TX,Granger Independent School District,unified_school_district,2025,researchable,not_researched,,
school_district,4821600,TX,Grape Creek Independent School District,unified_school_district,2025,researchable,not_researched,,
school_district,4821630,TX,Grapeland Independent School District,unified_school_district,2025,researchable,not_researched,,
school_district,4821660,TX,Grapevine-Colleyville Independent School District,unified_school_district,2025,researchable,not_researched,,
school_district,4821720,TX,Greenville Independent School District,unified_school_district,2025,researchable,not_researched,,
school_district,4821750,TX,Greenwood Independent School District,unified_school_district,2025,researchable,not_researched,,
school_district,4821780,TX,Gregory-Portland Independent School District,unified_school_district,2025,researchable,not_researched,,
school_district,4821810,TX,Groesbeck Independent School District,unified_school_district,2025,researchable,not_researched,,
school_district,4821840,TX,Groom Independent School District,unified_school_district,2025,researchable,not_researched,,
school_district,4821900,TX,Groveton Independent School District,unified_school_district,2025,researchable,not_researched,,
school_district,4821930,TX,Gruver Independent School District,unified_school_district,2025,researchable,not_researched,,
school_district,4821960,TX,Gunter Independent School District,unified_school_district,2025,researchable,not_researched,,
school_district,4821990,TX,Gustine Independent School District,unified_school_district,2025,researchable,not_researched,,
school_district,4822020,TX,Guthrie Common School District,unified_school_district,2025,researchable,not_researched,,
school_district,4822050,TX,Hale Center Independent School District,unified_school_district,2025,researchable,not_researched,,
school_district,4822120,TX,Hallettsville Independent School District,unified_school_district,2025,researchable,not_researched,,
school_district,4822140,TX,Hallsburg Independent School District,unified_school_district,2025,researchable,not_researched,,
school_district,4822170,TX,Hallsville Independent School District,unified_school_district,2025,researchable,not_researched,,
school_district,4822230,TX,Hamilton Independent School District,unified_school_district,2025,researchable,not_researched,,
school_district,4822260,TX,Hamlin Independent School District,unified_school_district,2025,researchable,not_researched,,
school_district,4822320,TX,Hamshire-Fannett Independent School District,unified_school_district,2025,researchable,not_researched,,
school_district,4822350,TX,Happy Independent School District,unified_school_district,2025,researchable,not_researched,,
school_district,4822380,TX,Hardin Independent School District,unified_school_district,2025,researchable,not_researched,,
school_district,4822410,TX,Hardin-Jefferson Independent School District,unified_school_district,2025,researchable,not_researched,,
school_district,4822470,TX,Harlandale Independent School District,unified_school_district,2025,researchable,not_researched,,
school_district,4822500,TX,Harleton Independent School District,unified_school_district,2025,researchable,not_researched,,
school_district,4822530,TX,Harlingen Consolidated Independent School District,unified_school_district,2025,researchable,not_researched,,
school_district,4822560,TX,Harmony Independent School District,unified_school_district,2025,researchable,not_researched,,
school_district,4822590,TX,Harper Independent School District,unified_school_district,2025,researchable,not_researched,,
school_district,4822620,TX,Harrold Independent School District,unified_school_district,2025,researchable,not_researched,,
school_district,4822650,TX,Hart Independent School District,unified_school_district,2025,researchable,not_researched,,
school_district,4822680,TX,Hartley Independent School District,unified_school_district,2025,researchable,not_researched,,
school_district,4822710,TX,Harts Bluff Independent School District,unified_school_district,2025,researchable,not_researched,,
school_district,4822740,TX,Haskell Consolidated Independent School District,unified_school_district,2025,researchable,not_researched,,
school_district,4822770,TX,Hawkins Independent School District,unified_school_district,2025,researchable,not_researched,,
school_district,4822800,TX,Hawley Independent School District,unified_school_district,2025,researchable,not_researched,,
school_district,4822830,TX,Hearne Independent School District,unified_school_district,2025,researchable,not_researched,,
school_district,4822850,TX,Hedley Independent School District,unified_school_district,2025,researchable,not_researched,,
school_district,4822890,TX,Hemphill Independent School District,unified_school_district,2025,researchable,not_researched,,
school_district,4822920,TX,Hempstead Independent School District,unified_school_district,2025,researchable,not_researched,,
school_district,4822970,TX,Henderson Independent School District,unified_school_district,2025,researchable,not_researched,,
school_district,4822980,TX,Henrietta Independent School District,unified_school_district,2025,researchable,not_researched,,
school_district,4823010,TX,Hereford Independent School District,unified_school_district,2025,researchable,not_researched,,
school_district,4823040,TX,Hermleigh Independent School District,unified_school_district,2025,researchable,not_researched,,
school_district,4823070,TX,Hico Independent School District,unified_school_district,2025,researchable,not_researched,,
school_district,4823100,TX,Hidalgo Independent School District,unified_school_district,2025,researchable,not_researched,,
school_district,4823160,TX,High Island Independent School District,unified_school_district,2025,researchable,not_researched,,
school_district,4823190,TX,Highland Independent School District,unified_school_district,2025,researchable,not_researched,,
school_district,4823250,TX,Highland Park Independent School District,unified_school_district,2025,researchable,not_researched,,
school_district,4823280,TX,Hillsboro Independent School District,unified_school_district,2025,researchable,not_researched,,
school_district,4823310,TX,Hitchcock Independent School District,unified_school_district,2025,researchable,not_researched,,
school_district,4823370,TX,Holland Independent School District,unified_school_district,2025,researchable,not_researched,,
school_district,4823400,TX,Holliday Independent School District,unified_school_district,2025,researchable,not_researched,,
school_district,4823430,TX,Hondo Independent School District,unified_school_district,2025,researchable,not_researched,,
school_district,4823460,TX,Honey Grove Independent School District,unified_school_district,2025,researchable,not_researched,,
school_district,4823490,TX,Hooks Independent School District,unified_school_district,2025,researchable,not_researched,,
school_district,4823640,TX,Houston Independent School District,unified_school_district,2025,researchable,candidate_found,2026-07-15,1 reviewed source link(s)
school_district,4823670,TX,Howe Independent School District,unified_school_district,2025,researchable,not_researched,,
school_district,4823700,TX,Hubbard Independent School District,unified_school_district,2025,researchable,not_researched,,
school_district,4823730,TX,Hubbard Independent School District,unified_school_district,2025,researchable,not_researched,,
school_district,4823760,TX,Huckabay Independent School District,unified_school_district,2025,researchable,not_researched,,
school_district,4823790,TX,Hudson Independent School District,unified_school_district,2025,researchable,not_researched,,
school_district,4823820,TX,Huffman Independent School District,unified_school_district,2025,researchable,not_researched,,
school_district,4823850,TX,Hughes Springs Independent School District,unified_school_district,2025,researchable,not_researched,,
school_district,4823880,TX,Hull-Daisetta Independent School District,unified_school_district,2025,researchable,not_researched,,
school_district,4823910,TX,Humble Independent School District,unified_school_district,2025,researchable,not_researched,,
school_district,4823970,TX,Hunt Independent School District,unified_school_district,2025,researchable,not_researched,,
school_district,4824000,TX,Huntington Independent School District,unified_school_district,2025,researchable,not_researched,,
school_district,4824030,TX,Huntsville Independent School District,unified_school_district,2025,researchable,not_researched,,
school_district,4824060,TX,Hurst-Euless-Bedford Independent School District,unified_school_district,2025,researchable,not_researched,,
school_district,4824100,TX,Hutto Independent School District,unified_school_district,2025,researchable,not_researched,,
school_district,4824120,TX,Idalou Independent School District,unified_school_district,2025,researchable,not_researched,,
school_district,4824150,TX,Industrial Independent School District,unified_school_district,2025,researchable,not_researched,,
school_district,4824180,TX,Ingleside Independent School District,unified_school_district,2025,researchable,not_researched,,
school_district,4824210,TX,Ingram Independent School District,unified_school_district,2025,researchable,not_researched,,
school_district,4824240,TX,Iola Independent School District,unified_school_district,2025,researchable,not_researched,,
school_district,4824260,TX,Iowa Park Consolidated Independent School District,unified_school_district,2025,researchable,not_researched,,
school_district,4824300,TX,Ira Independent School District,unified_school_district,2025,researchable,not_researched,,
school_district,4824330,TX,Iraan-Sheffield Collegiate Independent School District,unified_school_district,2025,researchable,not_researched,,
school_district,4824360,TX,Iredell Independent School District,unified_school_district,2025,researchable,not_researched,,
school_district,4824420,TX,Irving Independent School District,unified_school_district,2025,researchable,not_researched,,
school_district,4824450,TX,Italy Independent School District,unified_school_district,2025,researchable,not_researched,,
school_district,4824480,TX,Itasca Independent School District,unified_school_district,2025,researchable,not_researched,,
school_district,4824530,TX,Jacksboro Independent School District,unified_school_district,2025,researchable,not_researched,,
school_district,4824590,TX,Jacksonville Independent School District,unified_school_district,2025,researchable,not_researched,,
school_district,4824600,TX,Jarrell Independent School District,unified_school_district,2025,researchable,not_researched,,
school_district,4824630,TX,Jasper Independent School District,unified_school_district,2025,researchable,not_researched,,
school_district,4824660,TX,Jayton-Girard Independent School District,unified_school_district,2025,researchable,not_researched,,
school_district,4824730,TX,Jefferson Independent School District,unified_school_district,2025,researchable,not_researched,,
school_district,4824750,TX,Jim Hogg County Independent School District,unified_school_district,2025,researchable,not_researched,,
school_district,4824780,TX,Jim Ned Consolidated Independent School District,unified_school_district,2025,researchable,not_researched,,
school_district,4824810,TX,Joaquin Independent School District,unified_school_district,2025,researchable,not_researched,,
school_district,4824840,TX,Johnson City Independent School District,unified_school_district,2025,researchable,not_researched,,
school_district,4824900,TX,Jonesboro Independent School District,unified_school_district,2025,researchable,not_researched,,
school_district,4824930,TX,Joshua Independent School District,unified_school_district,2025,researchable,not_researched,,
school_district,4824960,TX,Jourdanton Independent School District,unified_school_district,2025,researchable,not_researched,,
school_district,4824990,TX,Judson Independent School District,unified_school_district,2025,researchable,not_researched,,
school_district,4825020,TX,Junction Independent School District,unified_school_district,2025,researchable,not_researched,,
school_district,4825110,TX,Karnack Independent School District,unified_school_district,2025,researchable,not_researched,,
school_district,4825140,TX,Karnes City Independent School District,unified_school_district,2025,researchable,not_researched,,
school_district,4825170,TX,Katy Independent School District,unified_school_district,2025,researchable,not_researched,,
school_district,4825200,TX,Kaufman Independent School District,unified_school_district,2025,researchable,not_researched,,
school_district,4825230,TX,Keene Independent School District,unified_school_district,2025,researchable,not_researched,,
school_district,4825260,TX,Keller Independent School District,unified_school_district,2025,researchable,not_researched,,
school_district,4825290,TX,Kelton Independent School District,unified_school_district,2025,researchable,not_researched,,
school_district,4825320,TX,Kemp Independent School District,unified_school_district,2025,researchable,not_researched,,
school_district,4825410,TX,Kenedy County-Wide Common School District,unified_school_district,2025,researchable,not_researched,,
school_district,4825440,TX,Kenedy Independent School District,unified_school_district,2025,researchable,not_researched,,
school_district,4825470,TX,Kennard Independent School District,unified_school_district,2025,researchable,not_researched,,
school_district,4825500,TX,Kennedale Independent School District,unified_school_district,2025,researchable,not_researched,,
school_district,4825530,TX,Kerens Independent School District,unified_school_district,2025,researchable,not_researched,,
school_district,4825560,TX,Kermit Independent School District,unified_school_district,2025,researchable,not_researched,,
school_district,4825590,TX,Kerrville Independent School District,unified_school_district,2025,researchable,not_researched,,
school_district,4825620,TX,Kilgore Independent School District,unified_school_district,2025,researchable,not_researched,,
school_district,4825660,TX,Killeen Independent School District,unified_school_district,2025,researchable,not_researched,,
school_district,4825680,TX,Kingsville Independent School District,unified_school_district,2025,researchable,not_researched,,
school_district,4825710,TX,Kirbyville Consolidated Independent School District,unified_school_district,2025,researchable,not_researched,,
school_district,4825740,TX,Klein Independent School District,unified_school_district,2025,researchable,not_researched,,
school_district,4825790,TX,Klondike Independent School District,unified_school_district,2025,researchable,not_researched,,
school_district,4825800,TX,Knippa Independent School District,unified_school_district,2025,researchable,not_researched,,
school_district,4825870,TX,Knox City-O'Brien Consolidated Independent School District,unified_school_district,2025,researchable,not_researched,,
school_district,4825890,TX,Kopperl Independent School District,unified_school_district,2025,researchable,not_researched,,
school_district,4825920,TX,Kountze Independent School District,unified_school_district,2025,researchable,not_researched,,
school_district,4825950,TX,Kress Independent School District,unified_school_district,2025,researchable,not_researched,,
school_district,4825980,TX,Krum Independent School District,unified_school_district,2025,researchable,not_researched,,
school_district,4826040,TX,La Feria Independent School District,unified_school_district,2025,researchable,not_researched,,
school_district,4826070,TX,La Gloria Independent School District,unified_school_district,2025,researchable,not_researched,,
school_district,4826100,TX,La Grange Independent School District,unified_school_district,2025,researchable,not_researched,,
school_district,4826130,TX,La Joya Independent School District,unified_school_district,2025,researchable,not_researched,,
school_district,4826190,TX,La Porte Independent School District,unified_school_district,2025,researchable,not_researched,,
school_district,4826220,TX,LaPoyner Independent School District,unified_school_district,2025,researchable,not_researched,,
school_district,4826250,TX,La Pryor Independent School District,unified_school_district,2025,researchable,not_researched,,
school_district,4826280,TX,La Vega Independent School District,unified_school_district,2025,researchable,not_researched,,
school_district,4826310,TX,La Vernia Independent School District,unified_school_district,2025,researchable,not_researched,,
school_district,4826340,TX,La Villa Independent School District,unified_school_district,2025,researchable,not_researched,,
school_district,4826370,TX,Lackland Independent School District,unified_school_district,2025,researchable,not_researched,,
school_district,4826400,TX,Lago Vista Independent School District,unified_school_district,2025,researchable,not_researched,,
school_district,4826430,TX,Lake Dallas Independent School District,unified_school_district,2025,researchable,not_researched,,
school_district,4826470,TX,Lake Travis Independent School District,unified_school_district,2025,researchable,not_researched,,
school_district,4826490,TX,Lake Worth Independent School District,unified_school_district,2025,researchable,not_researched,,
school_district,4826580,TX,Lamar Consolidated Independent School District,unified_school_district,2025,researchable,not_researched,,
school_district,4826610,TX,Lamesa Independent School District,unified_school_district,2025,researchable,not_researched,,
school_district,4826640,TX,Lampasas Independent School District,unified_school_district,2025,researchable,not_researched,,
school_district,4826670,TX,Lancaster Independent School District,unified_school_district,2025,researchable,not_researched,,
school_district,4826700,TX,Laneville Independent School District,unified_school_district,2025,researchable,not_researched,,
school_district,4826790,TX,Laredo Independent School District,unified_school_district,2025,researchable,not_researched,,
school_district,4826850,TX,Lasara Independent School District,unified_school_district,2025,researchable,not_researched,,
school_district,4826910,TX,Latexo Independent School District,unified_school_district,2025,researchable,not_researched,,
school_district,4826970,TX,Lazbuddie Independent School District,unified_school_district,2025,researchable,not_researched,,
school_district,4827000,TX,Leakey Independent School District,unified_school_district,2025,researchable,not_researched,,
school_district,4827030,TX,Leander Independent School District,unified_school_district,2025,researchable,not_researched,,
school_district,4827060,TX,Leary Independent School District,unified_school_district,2025,researchable,not_researched,,
school_district,4827090,TX,Lefors Independent School District,unified_school_district,2025,researchable,not_researched,,
school_district,4827120,TX,Leggett Independent School District,unified_school_district,2025,researchable,not_researched,,
school_district,4827180,TX,Leon Independent School District,unified_school_district,2025,researchable,not_researched,,
school_district,4827210,TX,Leonard Independent School District,unified_school_district,2025,researchable,not_researched,,
school_district,4827240,TX,Levelland Independent School District,unified_school_district,2025,researchable,not_researched,,
school_district,4827270,TX,Leveretts Chapel Independent School District,unified_school_district,2025,researchable,not_researched,,
school_district,4827300,TX,Lewisville Independent School District,unified_school_district,2025,researchable,not_researched,,
school_district,4827330,TX,Lexington Independent School District,unified_school_district,2025,researchable,not_researched,,
school_district,4827390,TX,Liberty-Eylau Independent School District,unified_school_district,2025,researchable,not_researched,,
school_district,4827420,TX,Liberty Hill Independent School District,unified_school_district,2025,researchable,not_researched,,
school_district,4827450,TX,Liberty Independent School District,unified_school_district,2025,researchable,not_researched,,
school_district,4827510,TX,Lindale Independent School District,unified_school_district,2025,researchable,not_researched,,
school_district,4827540,TX,Linden-Kildare Consolidated Independent School District,unified_school_district,2025,researchable,not_researched,,
